[
  {
    "id": "google-gemini",
    "name": "Google Gemini API",
    "provider": "Google",
    "description": "Frontier multimodal models on a permanent free tier — Flash and Flash-Lite families only since April 2026.",
    "free_limit": "1,500 requests/day on Flash, 1,000/day on Flash-Lite; 250K TPM",
    "requires_card": false,
    "requires_phone": false,
    "rate_limit": "10-15 RPM, 250K TPM",
    "models": [
      "gemini-3-flash",
      "gemini-3.1-flash-lite",
      "gemini-2.5-flash"
    ],
    "modalities": [
      "text",
      "vision",
      "audio",
      "video"
    ],
    "context_window": 1000000,
    "commercial_use": true,
    "data_used_for_training": true,
    "url": "https://ai.google.dev",
    "docs_url": "https://ai.google.dev/gemini-api/docs",
    "signup_url": "https://aistudio.google.com/apikey",
    "tags": [
      "essential",
      "multimodal",
      "long-context",
      "frontier",
      "no-card"
    ],
    "verified": "2026-09-24",
    "verified_by": "@seed-import",
    "status": "active",
    "notes": "Free-tier prompts are used to improve Google products outside the EU/UK/EEA. Pro models left the free tier in April 2026."
  },
  {
    "id": "groq",
    "name": "Groq Cloud",
    "provider": "Groq",
    "description": "Open-weight models at 300+ tokens/sec on LPU hardware, with the most generous request-per-day allowance of any free tier.",
    "free_limit": "1,000 req/day and 200K tokens/day per model",
    "free_limit_tokens_per_day": 200000,
    "requires_card": false,
    "requires_phone": false,
    "rate_limit": "30 RPM, 8K TPM",
    "models": [
      "gpt-oss-120b",
      "gpt-oss-20b",
      "qwen3.6-27b"
    ],
    "modalities": [
      "text"
    ],
    "context_window": 131072,
    "commercial_use": true,
    "data_used_for_training": false,
    "url": "https://groq.com",
    "docs_url": "https://console.groq.com/docs/rate-limits",
    "signup_url": "https://console.groq.com/keys",
    "tags": [
      "essential",
      "fast-inference",
      "openai-compatible",
      "no-card",
      "agents"
    ],
    "verified": "2026-09-24",
    "verified_by": "@seed-import",
    "status": "active",
    "notes": "The 200K tokens/day ceiling usually binds before the request count does. Llama models were removed from the free plan in 2026."
  },
  {
    "id": "openrouter-free",
    "name": "OpenRouter Free Models",
    "provider": "OpenRouter",
    "description": "One OpenAI-compatible key fronting 19+ `:free` models across providers — the best way to A/B models without multiple signups.",
    "free_limit": "50 requests/day (1,000/day after a one-time $10 credit purchase)",
    "requires_card": false,
    "requires_phone": false,
    "rate_limit": "20 RPM",
    "models": [
      "deepseek-v3.2",
      "llama-4-scout",
      "qwen3-coder",
      "gemma-3-27b"
    ],
    "modalities": [
      "text",
      "vision"
    ],
    "context_window": 262144,
    "commercial_use": true,
    "data_used_for_training": false,
    "url": "https://openrouter.ai",
    "docs_url": "https://openrouter.ai/docs/api-reference/limits",
    "signup_url": "https://openrouter.ai/settings/keys",
    "tags": [
      "essential",
      "multi-provider",
      "openai-compatible",
      "model-comparison",
      "no-card"
    ],
    "verified": "2026-09-24",
    "verified_by": "@seed-import",
    "status": "active",
    "notes": "The `:free` roster rotates monthly. Upstream providers frequently return 429s on free variants."
  },
  {
    "id": "cloudflare-workers-ai",
    "name": "Cloudflare Workers AI",
    "provider": "Cloudflare",
    "description": "Serverless inference that runs inside a Worker — no egress cost, no cold-start management, free daily budget.",
    "free_limit": "10,000 Neurons/day (roughly 3-8K short LLM calls/day)",
    "requires_card": false,
    "requires_phone": false,
    "rate_limit": "Account-level; unchanged by plan",
    "models": [
      "llama-3.3-70b",
      "gpt-oss-120b",
      "qwen3",
      "kimi-k2.5",
      "flux-1-schnell",
      "whisper"
    ],
    "modalities": [
      "text",
      "vision",
      "image-gen",
      "speech-to-text"
    ],
    "commercial_use": true,
    "data_used_for_training": false,
    "url": "https://developers.cloudflare.com/workers-ai/",
    "docs_url": "https://developers.cloudflare.com/workers-ai/platform/pricing/",
    "signup_url": "https://dash.cloudflare.com/sign-up",
    "tags": [
      "essential",
      "edge",
      "serverless",
      "embeddings",
      "no-card"
    ],
    "verified": "2026-09-24",
    "verified_by": "@seed-import",
    "status": "active",
    "notes": "Budget is denominated in Neurons, not tokens — per-model conversion varies, so budget by testing one call."
  },
  {
    "id": "github-models",
    "name": "GitHub Models",
    "provider": "GitHub / Microsoft",
    "description": "Frontier and open models behind a GitHub PAT — the lowest-friction free tier if you already have a GitHub account.",
    "free_limit": "150-1,000 requests/day depending on tier and model",
    "requires_card": false,
    "requires_phone": false,
    "rate_limit": "15 RPM",
    "models": [
      "gpt-4o",
      "claude-sonnet",
      "llama-4",
      "phi-4",
      "mistral-large"
    ],
    "modalities": [
      "text",
      "vision"
    ],
    "commercial_use": true,
    "data_used_for_training": false,
    "url": "https://github.com/features/models",
    "docs_url": "https://docs.github.com/en/github-models",
    "signup_url": "https://github.com/settings/personal-access-tokens",
    "tags": [
      "essential",
      "frontier",
      "no-card",
      "github-native",
      "prototyping"
    ],
    "verified": "2026-09-24",
    "verified_by": "@seed-import",
    "status": "active",
    "notes": "Intended for prototyping, not production traffic. Rate limits are per-model."
  },
  {
    "id": "mistral-la-plateforme",
    "name": "Mistral La Plateforme (Experiment)",
    "provider": "Mistral AI",
    "description": "European-hosted Mistral family with a free Experiment mode worth roughly $10/month of credits, no card required.",
    "free_limit": "~$10/month of credits in Experiment mode (about 1B tokens/month on small models)",
    "free_limit_tokens_per_day": 33000000,
    "requires_card": false,
    "requires_phone": true,
    "rate_limit": "2 RPM on free mode",
    "models": [
      "mistral-medium-3.5",
      "mistral-small-3.2",
      "magistral",
      "codestral"
    ],
    "modalities": [
      "text",
      "embeddings"
    ],
    "commercial_use": true,
    "data_used_for_training": true,
    "url": "https://mistral.ai",
    "docs_url": "https://docs.mistral.ai/getting-started/models/models_overview/",
    "signup_url": "https://console.mistral.ai/",
    "tags": [
      "essential",
      "eu-hosted",
      "code",
      "gdpr-friendly",
      "no-card"
    ],
    "verified": "2026-09-24",
    "verified_by": "@seed-import",
    "status": "active",
    "notes": "Experiment mode trains on your prompts by default. The 2 RPM limit makes it a batch/offline worker, not an interactive backend."
  },
  {
    "id": "nvidia-nim",
    "name": "NVIDIA NIM API Catalog",
    "provider": "NVIDIA",
    "description": "Free hosted endpoints for NVIDIA-curated open models (Nemotron, Llama, DeepSeek), built for prototyping.",
    "free_limit": "1,000 API credits (26,000 total requests) on signup",
    "requires_card": false,
    "requires_phone": false,
    "rate_limit": "Up to 40 RPM",
    "models": [
      "nemotron-4",
      "llama-3.3-70b",
      "deepseek-r1",
      "mixtral"
    ],
    "modalities": [
      "text",
      "vision",
      "embeddings"
    ],
    "commercial_use": true,
    "data_used_for_training": false,
    "url": "https://build.nvidia.com",
    "docs_url": "https://docs.api.nvidia.com",
    "signup_url": "https://build.nvidia.com/explore/discover",
    "tags": [
      "essential",
      "frontier",
      "open-models",
      "prototyping",
      "no-card"
    ],
    "verified": "2026-09-24",
    "verified_by": "@seed-import",
    "status": "active",
    "notes": "Credits are one-time and not refilled; some models are marked as evaluation-use only."
  },
  {
    "id": "zai-glm-free",
    "name": "Z.ai GLM Flash Models",
    "provider": "Z.ai (Zhipu)",
    "description": "GLM-4.x Flash models served free of charge, popular as a drop-in for reasoning and coding agents.",
    "free_limit": "Unmetered access to GLM-4.7-Flash and GLM-4.5-Flash",
    "requires_card": false,
    "requires_phone": true,
    "rate_limit": "Community-tier concurrency limits",
    "models": [
      "glm-4.7-flash",
      "glm-4.5-flash"
    ],
    "modalities": [
      "text"
    ],
    "context_window": 128000,
    "commercial_use": true,
    "data_used_for_training": false,
    "url": "https://z.ai",
    "docs_url": "https://docs.z.ai/guides/overview/pricing",
    "signup_url": "https://z.ai/",
    "tags": [
      "agentic",
      "coding",
      "no-card"
    ],
    "verified": "2026-09-24",
    "verified_by": "@seed-import",
    "status": "active",
    "notes": "Flash tiers are free but rate-limited during peak hours in Asia."
  },
  {
    "id": "cohere-trial",
    "name": "Cohere Trial Keys",
    "provider": "Cohere",
    "description": "Every Cohere model including Command A and the Embed/Rerank family on a free trial key, non-commercial use only.",
    "free_limit": "1,000 API calls/month",
    "requires_card": false,
    "requires_phone": false,
    "rate_limit": "20 RPM",
    "models": [
      "command-a",
      "command-r-plus",
      "embed-v4",
      "rerank-v3.5"
    ],
    "modalities": [
      "text",
      "embeddings",
      "rerank"
    ],
    "commercial_use": false,
    "data_used_for_training": false,
    "url": "https://cohere.com",
    "docs_url": "https://docs.cohere.com/docs/rate-limits",
    "signup_url": "https://dashboard.cohere.com/api-keys",
    "tags": [
      "rag",
      "embeddings",
      "rerank",